{
  "interface_version": "1.0.0",
  "request_id": "req_lunch_box_001",
  "phase": "evidence_pass",
  "evidence_mode": "direct_1688",
  "reviewed_candidates": [
    {
      "candidate_id": "cand_guangcheng_001",
      "status": "kept",
      "supplier_name": "潮州市潮安区彩塘镇广成不锈钢制品厂",
      "product_title": "304不锈钢饭盒带盖上班族餐盒学生便携分2三格不串味便当盒高颜值",
      "supplier_page_link": "https://chaozhougc.1688.com/",
      "evidence_pages": [
        {
          "page_role": "product_detail",
          "evidence_page_link": "https://detail.1688.com/offer/908205986518.html?cosite=-&tracelog=p4p&_p_isad=1&clickid=9cf026eabacb4ac1ba0bdbbbf7347e0e&sessionid=22e952944ca91af1bdfc0d05ba3385c4",
          "source_1688_link": "https://detail.1688.com/offer/908205986518.html?cosite=-&tracelog=p4p&_p_isad=1&clickid=9cf026eabacb4ac1ba0bdbbbf7347e0e&sessionid=22e952944ca91af1bdfc0d05ba3385c4",
          "page_summary": "product detail page showed the lunch-box listing title, price band, MOQ, sales volume, and product attributes"
        },
        {
          "page_role": "supplier_page",
          "evidence_page_link": "https://chaozhougc.1688.com/",
          "source_1688_link": "https://chaozhougc.1688.com/",
          "page_summary": "supplier shop page showed a long-running factory-like shop with populated product breadth and service metrics"
        }
      ],
      "page_visible_facts": [
        "supplier page shows 入驻9年",
        "supplier page shows 主营：餐具",
        "supplier page shows 店铺回头率77%",
        "supplier page shows 店铺服务分4.5分",
        "supplier page shows 准时发货率81%",
        "supplier page shows 店铺好评率99.9%",
        "product page shows 材质 304不锈钢",
        "product page shows 价格 ¥23.25",
        "product page shows 4个起批",
        "product page shows 已售2200+个",
        "product page shows 规格包含小号二格/小号三格/大号四格多种颜色",
        "product page shows 是否保温 否 and 盒子层数 单层"
      ],
      "heuristic_judgments": [
        "supplier identity looks stable and the shop appears active enough for shortlist retention",
        "product and shop breadth are aligned with stainless-steel food-container sourcing",
        "commercial signals are strong enough to revisit later"
      ],
      "unknowns": [
        "factory-direct status is not independently proven on-page",
        "certification details are only partially visible and not validated",
        "true production capacity and export depth remain unclear"
      ],
      "representative_products": [
        {
          "title": "304不锈钢饭盒带盖上班族餐盒学生便携分2三格不串味便当盒高颜值",
          "evidence_link": "https://detail.1688.com/offer/908205986518.html?cosite=-&tracelog=p4p&_p_isad=1&clickid=9cf026eabacb4ac1ba0bdbbbf7347e0e&sessionid=22e952944ca91af1bdfc0d05ba3385c4",
          "source_1688_link": "https://detail.1688.com/offer/908205986518.html?cosite=-&tracelog=p4p&_p_isad=1&clickid=9cf026eabacb4ac1ba0bdbbbf7347e0e&sessionid=22e952944ca91af1bdfc0d05ba3385c4",
          "visible_price_moq": "¥23.25; 4个起批",
          "notes": "visible 304 stainless-steel lunch-box listing with sales and variant clues"
        }
      ]
    },
    {
      "candidate_id": "cand_xuanzhen_002",
      "status": "kept",
      "supplier_name": "龙港市萱甄工艺品厂",
      "product_title": "跨境304不锈钢饭盒保温上班族小学生分格便当盒分隔食堂打饭餐盒",
      "supplier_page_link": "https://shop87n77471lx561.1688.com/",
      "evidence_pages": [
        {
          "page_role": "product_detail",
          "evidence_page_link": "https://detail.1688.com/offer/1028813801883.html?cosite=-&tracelog=p4p&_p_isad=1&clickid=02001f4b42ac49e1904647a6b1d37fc1&sessionid=22e952944ca91af1bdfc0d05ba3385c4",
          "source_1688_link": "https://detail.1688.com/offer/1028813801883.html?cosite=-&tracelog=p4p&_p_isad=1&clickid=02001f4b42ac49e1904647a6b1d37fc1&sessionid=22e952944ca91af1bdfc0d05ba3385c4",
          "page_summary": "product detail page showed a readable cross-border electric lunch-box listing with price, MOQ, and shipping cues"
        },
        {
          "page_role": "supplier_page",
          "evidence_page_link": "https://shop87n77471lx561.1688.com/",
          "source_1688_link": "https://shop87n77471lx561.1688.com/",
          "page_summary": "supplier shop page showed a newly opened but active shop with many mixed product listings and export-oriented signals"
        }
      ],
      "page_visible_facts": [
        "supplier page shows 入驻1年",
        "supplier page shows 主营：家用电器",
        "supplier page shows 店铺回头率40%",
        "supplier page shows 店铺服务分4.5分",
        "supplier page shows 准时发货率97%",
        "supplier page shows 店铺好评率100.0%",
        "product page shows 新人价 ¥38.50起",
        "product page shows 首件预估到手价 ¥39.50-42.00",
        "product page shows 1台起批",
        "product page shows 60+人想买",
        "product page shows 是否跨境出口专供货源 是",
        "product page shows 主要下游平台 eBay/亚马逊/wish/速卖通/独立站/LAZADA"
      ],
      "heuristic_judgments": [
        "supplier is active and has strong shipping metrics, so it is still worth retaining",
        "product is clearly visible and export-oriented, but the shop category mix is broader and less focused than the top candidate",
        "commercial fit is weaker than candidate 1, yet the evidence is still usable"
      ],
      "unknowns": [
        "the company intro/category mix is not fully consistent with the product line",
        "factory-direct status is not independently proven on-page",
        "actual business focus and depth in lunch-box sourcing remain unclear"
      ],
      "representative_products": [
        {
          "title": "跨境304不锈钢饭盒保温上班族小学生分格便当盒分隔食堂打饭餐盒",
          "evidence_link": "https://detail.1688.com/offer/1028813801883.html?cosite=-&tracelog=p4p&_p_isad=1&clickid=02001f4b42ac49e1904647a6b1d37fc1&sessionid=22e952944ca91af1bdfc0d05ba3385c4",
          "source_1688_link": "https://detail.1688.com/offer/1028813801883.html?cosite=-&tracelog=p4p&_p_isad=1&clickid=02001f4b42ac49e1904647a6b1d37fc1&sessionid=22e952944ca91af1bdfc0d05ba3385c4",
          "visible_price_moq": "¥38.50起; 1台起批",
          "notes": "cross-border electric lunch-box listing with export/platform clues"
        }
      ]
    },
    {
      "candidate_id": "cand_hongfu_001",
      "status": "kept",
      "supplier_name": "潮州市宏富五金制品有限公司",
      "product_title": "304不锈钢食品级两三格分格饭盒便当盒减脂餐定量密封不串味跨境",
      "supplier_page_link": "https://cahongfu.1688.com/?offerId=992411055961&td_page_id=PC-DEFAULT-2025",
      "evidence_pages": [
        {
          "page_role": "product_detail",
          "evidence_page_link": "https://detail.1688.com/offer/992411055961.html?offerId=992411055961&sortType=&pageId=&abBizDataType=cbuOffer&hotSaleSkuId=6225815567309&trace_log=normal&uuid=a54ddddc99c94568a9c6f562ce83c61c&forcePC=1776388637674",
          "source_1688_link": "https://detail.1688.com/offer/992411055961.html?offerId=992411055961&sortType=&pageId=&abBizDataType=cbuOffer&hotSaleSkuId=6225815567309&trace_log=normal&uuid=a54ddddc99c94568a9c6f562ce83c61c&forcePC=1776388637674",
          "page_summary": "产品页标题与候选商品一致，页面可见店铺信息指向潮州市宏富五金制品有限公司。"
        },
        {
          "page_role": "supplier_page",
          "evidence_page_link": "https://cahongfu.1688.com/?offerId=992411055961&td_page_id=PC-DEFAULT-2025",
          "source_1688_link": "https://cahongfu.1688.com/?offerId=992411055961&td_page_id=PC-DEFAULT-2025",
          "page_summary": "店铺页显示潮州市宏富五金制品有限公司，入驻15年，主营日用餐厨饮具，回头率56.5%，广东潮州，2021.07成立。"
        }
      ],
      "page_visible_facts": [
        "产品页标题：304不锈钢食品级两三格分格饭盒便当盒减脂餐定量密封不串味跨境",
        "店铺名：潮州市宏富五金制品有限公司",
        "入驻15年",
        "主营类目：日用餐厨饮具/餐具",
        "回头率：56.5%（店铺页）/57%（产品页店铺卡）",
        "服务分：4.5",
        "准时发货率：98%",
        "店铺好评率：100.0%",
        "广东 潮州",
        "2021.07成立",
        "2026上榜一钻工厂"
      ],
      "heuristic_judgments": [
        "产品页与店铺页名称一致，指向同一供应商。",
        "店铺资历与经营数据可见，适合作为保留候选。",
        "当前未在可见区域稳定获取该商品的起批量/完整价格信息。"
      ],
      "unknowns": [
        "未直接看到该候选商品的完整价格与MOQ组合",
        "未核实该商品是否为店铺主推款或唯一对应款"
      ],
      "representative_products": [
        {
          "title": "304不锈钢食品级两三格分格饭盒便当盒减脂餐定量密封不串味跨境",
          "evidence_link": "https://detail.1688.com/offer/992411055961.html?offerId=992411055961&sortType=&pageId=&abBizDataType=cbuOffer&hotSaleSkuId=6225815567309&trace_log=normal&uuid=a54ddddc99c94568a9c6f562ce83c61c&forcePC=1776388637674",
          "source_1688_link": "https://detail.1688.com/offer/992411055961.html?offerId=992411055961&sortType=&pageId=&abBizDataType=cbuOffer&hotSaleSkuId=6225815567309&trace_log=normal&uuid=a54ddddc99c94568a9c6f562ce83c61c&forcePC=1776388637674",
          "visible_price_moq": "未见",
          "notes": "候选产品页标题可见，但当前可见区域未稳定显示价格/MOQ。"
        }
      ]
    }
  ],
  "limitations": [
    "The first two candidates came from the base April 17 phased evidence pass.",
    "The third candidate was added through a narrow supplemental single-candidate probe after the first phased run ended with only 2 suppliers.",
    "The supplemental hongfu probe required transcript normalization because Hermes emitted JSON with a banner and trailing session metadata."
  ]
}
